text,incident_type,source,source_url,article_title,date
"Welcome to the 24th edition of Cloudflare’s Quarterly DDoS Threat Report. In this report,Cloudforce Oneoffers a comprehensive analysis of the evolving threat landscape ofDistributed Denial of Service (DDoS) attacksbased on data from theCloudflare network. In this edition, we focus on the fourth quarter of 2025, as well as share overall 2025 data.",Denial of Service,Cloudflare Blog,https://blog.cloudflare.com/ddos-threat-report-2025-q4/,2025 Q4 DDoS threat report: A record-setting 31.4 Tbps attack caps a year of massive DDoS assaults,
"The fourth quarter of 2025 was characterized by an unprecedented bombardment launched by theAisuru-Kimwolf botnet, dubbed “The Night Before Christmas"" DDoS attack campaign. The campaign targeted Cloudflare customers as well as Cloudflare’s dashboard and infrastructure with hyper-volumetric HTTP DDoS attacks exceeding rates of 200 million requests per second (rps), just weeks after a record-breaking 31.4 Terabits per second (Tbps) attack.",Denial of Service,Cloudflare Blog,https://blog.cloudflare.com/ddos-threat-report-2025-q4/,2025 Q4 DDoS threat report: A record-setting 31.4 Tbps attack caps a year of massive DDoS assaults,
"DDoS attacks surged by 121% in 2025, reaching an average of 5,376 attacks automatically mitigated every hour.",Denial of Service,Cloudflare Blog,https://blog.cloudflare.com/ddos-threat-report-2025-q4/,2025 Q4 DDoS threat report: A record-setting 31.4 Tbps attack caps a year of massive DDoS assaults,
"In the final quarter of 2025, Hong Kong jumped 12 places, making it the second most DDoS’d place on earth. The United Kingdom also leapt by an astonishing 36 places, making it the sixth most-attacked place.",Denial of Service,Cloudflare Blog,https://blog.cloudflare.com/ddos-threat-report-2025-q4/,2025 Q4 DDoS threat report: A record-setting 31.4 Tbps attack caps a year of massive DDoS assaults,
"Infected Android TVs — part of the Aisuru-Kimwolf botnet — bombarded Cloudflare’s network with hyper-volumetric HTTP DDoS attacks, while Telcos emerged as the most-attacked industry.",Denial of Service,Cloudflare Blog,https://blog.cloudflare.com/ddos-threat-report-2025-q4/,2025 Q4 DDoS threat report: A record-setting 31.4 Tbps attack caps a year of massive DDoS assaults,
"In 2025, the total number of DDoS attacks more than doubled to an incredible 47.1 million. Such attacks have soared in recent years: The number of DDoS attacks spiked 236% between 2023 and 2025.",Denial of Service,Cloudflare Blog,https://blog.cloudflare.com/ddos-threat-report-2025-q4/,2025 Q4 DDoS threat report: A record-setting 31.4 Tbps attack caps a year of massive DDoS assaults,
"In 2025, Cloudflare mitigated an average of 5,376 DDoS attacks every hour — of these, 3,925 were network-layer DDoS attacks and 1,451 were HTTP DDoS attacks.",Denial of Service,Cloudflare Blog,https://blog.cloudflare.com/ddos-threat-report-2025-q4/,2025 Q4 DDoS threat report: A record-setting 31.4 Tbps attack caps a year of massive DDoS assaults,
"The most substantial growth was in network-layer DDoS attacks, which more than tripled year over year. Cloudflare mitigated 34.4 million network-layer DDoS attacks in 2025, compared to 11.4 million in 2024.",Denial of Service,Cloudflare Blog,https://blog.cloudflare.com/ddos-threat-report-2025-q4/,2025 Q4 DDoS threat report: A record-setting 31.4 Tbps attack caps a year of massive DDoS assaults,
"A substantial portion of the network-layer attacks — approximately 13.5 million — targeted global Internet infrastructure protected byCloudflare Magic Transitand Cloudflare’s infrastructure directly, as part of an 18-day DDoS campaign in the first quarter of 2025. Of these attacks, 6.9 million targeted Magic Transit customers while the remaining 6.6 million targeted Cloudflare directly.",Denial of Service,Cloudflare Blog,https://blog.cloudflare.com/ddos-threat-report-2025-q4/,2025 Q4 DDoS threat report: A record-setting 31.4 Tbps attack caps a year of massive DDoS assaults,
"This assault was a multi-vector DDoS campaign comprisingSYN flood attacks,Mirai-generated DDoS attacks, andSSDP amplification attacksto name a few. Our systems detected and mitigated these attacks automatically. In fact, we only discovered the campaign while preparing ourDDoS threat report for 2025 Q1— an example of how effective Cloudflare’s DDoS mitigation is!",Denial of Service,Cloudflare Blog,https://blog.cloudflare.com/ddos-threat-report-2025-q4/,2025 Q4 DDoS threat report: A record-setting 31.4 Tbps attack caps a year of massive DDoS assaults,
"In the final quarter of 2025, the number of DDoS attacks grew by 31% over the previous quarter and 58% over 2024. Network-layer DDoS attacks fueled that growth. In 2025 Q4, network-layer DDoS attacks accounted for 78% of all DDoS attacks. The amount of HTTP DDoS attacks remained the same, but surged in their size to rates that we haven’t seen since theHTTP/2 Rapid Reset DDoS campaignin 2023. These recent surges were launched by theAisuru-Kimwolf botnet, which we will cover in the next section.",Denial of Service,Cloudflare Blog,https://blog.cloudflare.com/ddos-threat-report-2025-q4/,2025 Q4 DDoS threat report: A record-setting 31.4 Tbps attack caps a year of massive DDoS assaults,
"On Friday, December 19, 2025, theAisuru-Kimwolf botnetbegan bombarding Cloudflare infrastructure and Cloudflare customers with hyper-volumetric DDoS attacks. What was new in this campaign was its size: The botnet used hyper-volumetric HTTP DDoS attacks exceeding rates of 20 million requests per second (Mrps).",Denial of Service,Cloudflare Blog,https://blog.cloudflare.com/ddos-threat-report-2025-q4/,2025 Q4 DDoS threat report: A record-setting 31.4 Tbps attack caps a year of massive DDoS assaults,
"The Aisuru-Kimwolf botnet is a massive collection ofmalware-infected devices, primarily Android TVs. The botnet comprises an estimated 1-4 million infected hosts. It is capable of launching DDoS attacks that can cripple critical infrastructure, crash most legacy cloud-based DDoS protection solutions, and even disrupt the connectivity of entire nations.",Denial of Service,Cloudflare Blog,https://blog.cloudflare.com/ddos-threat-report-2025-q4/,2025 Q4 DDoS threat report: A record-setting 31.4 Tbps attack caps a year of massive DDoS assaults,
"Throughout the campaign, Cloudflare’s autonomous DDoS defense systems detected and mitigated all of the attacks: 384 packet-intensive attacks, 329 bit-intensive attacks, and 189 request-intensive attacks, for a total of 902 hyper-volumetric DDoS attacks, averaging 53 attacks a day.",Denial of Service,Cloudflare Blog,https://blog.cloudflare.com/ddos-threat-report-2025-q4/,2025 Q4 DDoS threat report: A record-setting 31.4 Tbps attack caps a year of massive DDoS assaults,
"The average size of the hyper-volumetric DDoS attacks during the campaign were 3 Bpps, 4 Tbps, and 54 Mrps. The maximum rates recorded during the campaign were 9 Bpps, 24 Tbps, and 205 Mrps.",Denial of Service,Cloudflare Blog,https://blog.cloudflare.com/ddos-threat-report-2025-q4/,2025 Q4 DDoS threat report: A record-setting 31.4 Tbps attack caps a year of massive DDoS assaults,
"To put that in context, the scale of a 205 Mrps DDoS attack is comparable to the combined populations of the UK, Germany, and Spain all simultaneously typing a website address and then hitting 'enter’ at the same second.",Denial of Service,Cloudflare Blog,https://blog.cloudflare.com/ddos-threat-report-2025-q4/,2025 Q4 DDoS threat report: A record-setting 31.4 Tbps attack caps a year of massive DDoS assaults,
"While highly dramatic, The Night Before Christmas campaign accounted for only a small portion of the hyper-volumetric DDoS attacks we saw throughout the year.",Denial of Service,Cloudflare Blog,https://blog.cloudflare.com/ddos-threat-report-2025-q4/,2025 Q4 DDoS threat report: A record-setting 31.4 Tbps attack caps a year of massive DDoS assaults,
"Throughout 2025, Cloudflare observed a continuous increase in hyper-volumetric DDoS attacks. In 2025 Q4, hyper-volumetric attacks increased by 40% compared to the previous quarter.",Denial of Service,Cloudflare Blog,https://blog.cloudflare.com/ddos-threat-report-2025-q4/,2025 Q4 DDoS threat report: A record-setting 31.4 Tbps attack caps a year of massive DDoS assaults,
"As the number of attacks increased over the course of 2025, the size of the attacks increased as well, growing by over 700% compared to the large attacks seen in late 2024, with one reaching 31.4 Tbps in a DDoS attack that lasted just 35 seconds. The graph below portrays the rapid growth in DDoS attack sizes as seen and blocked by Cloudflare — each one a world record, i.e. the largest ever disclosed publicly by any company at the time.",Denial of Service,Cloudflare Blog,https://blog.cloudflare.com/ddos-threat-report-2025-q4/,2025 Q4 DDoS threat report: A record-setting 31.4 Tbps attack caps a year of massive DDoS assaults,
"Like all of the other attacks, the 31.4 Tbps DDoS attack was detected and mitigated automatically by Cloudflare’s autonomous DDoS defense, which was able to adapt and quickly lock on to botnets such as Aisuru-Kimwolf.",Denial of Service,Cloudflare Blog,https://blog.cloudflare.com/ddos-threat-report-2025-q4/,2025 Q4 DDoS threat report: A record-setting 31.4 Tbps attack caps a year of massive DDoS assaults,
"Most of the hyper-volumetric DDoS attacks targeted Cloudflare customers in the Telecommunications, Service Providers and Carriers industry. Cloudflare customers in the Gaming industry and customers providing Generative AI services were also heavily targeted. Lastly, Cloudflare’s own infrastructure itself was targeted by multiple attack vectors such asHTTP floods,DNS attacksandUDP flood.",Denial of Service,Cloudflare Blog,https://blog.cloudflare.com/ddos-threat-report-2025-q4/,2025 Q4 DDoS threat report: A record-setting 31.4 Tbps attack caps a year of massive DDoS assaults,
"When analyzing DDoS attacks of all sizes, the Telecommunications, Service Providers and Carriers industry was also the most targeted. Previously, the Information Technology & Services industry held that unlucky title.",Denial of Service,Cloudflare Blog,https://blog.cloudflare.com/ddos-threat-report-2025-q4/,2025 Q4 DDoS threat report: A record-setting 31.4 Tbps attack caps a year of massive DDoS assaults,
"The most-attacked industries are defined by their role as critical infrastructure, a central backbone for other businesses, or their immediate, high-stakes financial sensitivity to service interruption and latency.",Denial of Service,Cloudflare Blog,https://blog.cloudflare.com/ddos-threat-report-2025-q4/,2025 Q4 DDoS threat report: A record-setting 31.4 Tbps attack caps a year of massive DDoS assaults,
"The DDoS landscape saw both predictable stability and dramatic shifts among the world's most-attacked locations. Targets like China, Germany, Brazil, and the United States were the top five, demonstrating persistent appeal for attackers.",Denial of Service,Cloudflare Blog,https://blog.cloudflare.com/ddos-threat-report-2025-q4/,2025 Q4 DDoS threat report: A record-setting 31.4 Tbps attack caps a year of massive DDoS assaults,
"Hong Kong made a significant move, jumping twelve spots to land at number two. However, the bigger story was the meteoric rise of the United Kingdom, which surged an astonishing 36 places this quarter, making it the sixth most-attacked location.",Denial of Service,Cloudflare Blog,https://blog.cloudflare.com/ddos-threat-report-2025-q4/,2025 Q4 DDoS threat report: A record-setting 31.4 Tbps attack caps a year of massive DDoS assaults,
"Vietnam held its place as the seventh most-attacked location, followed by Azerbaijan in eighth, India in ninth, and Singapore as number ten.",Denial of Service,Cloudflare Blog,https://blog.cloudflare.com/ddos-threat-report-2025-q4/,2025 Q4 DDoS threat report: A record-setting 31.4 Tbps attack caps a year of massive DDoS assaults,
"Bangladesh dethroned Indonesia as the largest source of DDoS attacks in the fourth quarter of 2025. Indonesia dropped to the third spot, after spending a year as the top source of DDoS attacks. Ecuador also jumped two spots, making it the second-largest source.",Denial of Service,Cloudflare Blog,https://blog.cloudflare.com/ddos-threat-report-2025-q4/,2025 Q4 DDoS threat report: A record-setting 31.4 Tbps attack caps a year of massive DDoS assaults,
"Notably, Argentina soared an incredible twenty places, making it the fourth-largest source of DDoS attacks. Hong Kong rose three places, taking fifth place. Ukraine came in sixth place, followed by Vietnam, Taiwan, Singapore, and Peru.",Denial of Service,Cloudflare Blog,https://blog.cloudflare.com/ddos-threat-report-2025-q4/,2025 Q4 DDoS threat report: A record-setting 31.4 Tbps attack caps a year of massive DDoS assaults,
"The top 10 list of attack source networks reads like a list of Internet giants, revealing a fascinating story about the anatomy of modern DDoS attacks. The common thread is clear: Threat actors are leveraging the world's most accessible and powerful network infrastructure — primarily large, public-facing services.",Denial of Service,Cloudflare Blog,https://blog.cloudflare.com/ddos-threat-report-2025-q4/,2025 Q4 DDoS threat report: A record-setting 31.4 Tbps attack caps a year of massive DDoS assaults,
"We see most DDoS attacks coming from IP addresses associated with Cloud Computing Platforms and Cloud Infrastructure Providers, includingDigitalOcean (AS 14061),Microsoft (AS 8075),Tencent (AS 132203),Oracle (AS 31898), andHetzner (AS 24940). This demonstrates the strong link between easily-provisioned virtual machines and high-volume attacks. These cloud sources, heavily concentrated in the United States, are closely followed by a significant presence of attacks coming from IP addresses associated with traditional Telecommunications Providers (Telcos). These Telcos, primarily from the Asia-Pacific region (including Vietnam, China, Malaysia, and Taiwan), round out the rest of the top 10.",Denial of Service,Cloudflare Blog,https://blog.cloudflare.com/ddos-threat-report-2025-q4/,2025 Q4 DDoS threat report: A record-setting 31.4 Tbps attack caps a year of massive DDoS assaults,
"This geographic and organizational diversity confirms a two-pronged attack reality: While the sheer scale of the highest-ranking sources often originates from global cloud hubs, the problem is truly worldwide, routed through the Internet's most critical pathways from across the globe. In many DDoS attacks, we see thousands of various source ASNs, highlighting the truly global distribution of botnet nodes.",Denial of Service,Cloudflare Blog,https://blog.cloudflare.com/ddos-threat-report-2025-q4/,2025 Q4 DDoS threat report: A record-setting 31.4 Tbps attack caps a year of massive DDoS assaults,
"To help hosting providers, cloud computing platforms and Internet service providers identify and take down the abusive IP addresses/accounts that launch these attacks, we leverage Cloudflare’s unique vantage point on DDoS attacks to provide afree DDoS Botnet Threat Feed for Service Providers.",Denial of Service,Cloudflare Blog,https://blog.cloudflare.com/ddos-threat-report-2025-q4/,2025 Q4 DDoS threat report: A record-setting 31.4 Tbps attack caps a year of massive DDoS assaults,
"Over 800 networks worldwide have signed up for this feed, and we’ve already seen great collaboration across the community to take down botnet nodes.",Denial of Service,Cloudflare Blog,https://blog.cloudflare.com/ddos-threat-report-2025-q4/,2025 Q4 DDoS threat report: A record-setting 31.4 Tbps attack caps a year of massive DDoS assaults,
"DDoS attacks are rapidly growing in sophistication and size, surpassing what was previously imaginable. This evolving threat landscape presents a significant challenge for many organizations to keep pace. Organizations currently relying on on-premise mitigation appliances or on-demand scrubbing centers may benefit from re-evaluating their defense strategy.",Denial of Service,Cloudflare Blog,https://blog.cloudflare.com/ddos-threat-report-2025-q4/,2025 Q4 DDoS threat report: A record-setting 31.4 Tbps attack caps a year of massive DDoS assaults,
"Welcome to the 23rd edition of Cloudflare’s Quarterly DDoS Threat Report. This report offers a comprehensive analysis of the evolving threat landscape ofDistributed Denial of Service (DDoS) attacksbased on data from theCloudflare network. In this edition, we focus on the third quarter of 2025.",Denial of Service,Cloudflare Blog,https://blog.cloudflare.com/ddos-threat-report-2025-q3/,"Cloudflare's 2025 Q3 DDoS threat report -- including Aisuru, the apex of botnets",
"The third quarter of 2025 was overshadowed by the Aisuru botnet with a massive army of an estimated 1–4 million infected hosts globally. Aisuru unleashed hyper-volumetric DDoS attacks routinely exceeding 1 terabit per second (Tbps) and 1 billion packets per second (Bpps). The number of these attacks surged 54% quarter-over-quarter (QoQ), averaging 14 hyper-volumetric attacks daily. The scale was unprecedented, with attacks peaking at 29.7 Tbps and 14.1 Bpps.",Denial of Service,Cloudflare Blog,https://blog.cloudflare.com/ddos-threat-report-2025-q3/,"Cloudflare's 2025 Q3 DDoS threat report -- including Aisuru, the apex of botnets",
"DDoS attack traffic against AI companies surged by as much as 347% MoM in September 2025, as public concern and regulatory review of AI increases.",Denial of Service,Cloudflare Blog,https://blog.cloudflare.com/ddos-threat-report-2025-q3/,"Cloudflare's 2025 Q3 DDoS threat report -- including Aisuru, the apex of botnets",
"Escalating EU-China trade tensions over rare earth minerals and EV tariffs coincide with a significant increase in DDoS attacks against the Mining, Minerals & Metals industry as well as the Automotive industry in 2025 Q3.",Denial of Service,Cloudflare Blog,https://blog.cloudflare.com/ddos-threat-report-2025-q3/,"Cloudflare's 2025 Q3 DDoS threat report -- including Aisuru, the apex of botnets",
"Overall, in the third quarter of 2025, Cloudflare’s autonomous defenses blocked a total of 8.3 million DDoS attacks. That’s an average of almost 3,780 DDoS attacks per hour. The number of DDoS attacks grew by 15% QoQ and 40% YoY.",Denial of Service,Cloudflare Blog,https://blog.cloudflare.com/ddos-threat-report-2025-q3/,"Cloudflare's 2025 Q3 DDoS threat report -- including Aisuru, the apex of botnets",
"So far in 2025, and with an entire quarter to go until the end of the year, Cloudflare has already mitigated 36.2 million DDoS attacks. That corresponds to 170% of the DDoS attacks Cloudflare mitigated throughout 2024.",Denial of Service,Cloudflare Blog,https://blog.cloudflare.com/ddos-threat-report-2025-q3/,"Cloudflare's 2025 Q3 DDoS threat report -- including Aisuru, the apex of botnets",
"In the third quarter of 2025, Cloudflare automatically detected and mitigated 8.3 million DDoS attacks, representing a 15% increase QoQ and 40% increase YoY.",Denial of Service,Cloudflare Blog,https://blog.cloudflare.com/ddos-threat-report-2025-q3/,"Cloudflare's 2025 Q3 DDoS threat report -- including Aisuru, the apex of botnets",
"Network-layer DDoS attacks, accounting for 71% of the DDoS attacks in 2025 Q3, or 5.9 million DDoS attacks, increased by 87% QoQ and 95% YoY. However, HTTP DDoS attacks, accounting only for 29% of the DDoS attacks in 2025 Q3, or 2.4 million DDoS attacks, decreased by 41% QoQ and 17% YoY.",Denial of Service,Cloudflare Blog,https://blog.cloudflare.com/ddos-threat-report-2025-q3/,"Cloudflare's 2025 Q3 DDoS threat report -- including Aisuru, the apex of botnets",
"In the third quarter of 2025, Cloudflare mitigated an average of 3,780 DDoS attacks every hour.",Denial of Service,Cloudflare Blog,https://blog.cloudflare.com/ddos-threat-report-2025-q3/,"Cloudflare's 2025 Q3 DDoS threat report -- including Aisuru, the apex of botnets",
"Aisuru targeted telecommunication providers,gaming companies, hosting providers, andfinancial services, to name a few. It has also caused “widespread collateral Internet disruption [in the US]”, asreported by Krebs on Security, simply due to the amount of botnet traffic routing through the Internet Service Providers (ISPs).",Denial of Service,Cloudflare Blog,https://blog.cloudflare.com/ddos-threat-report-2025-q3/,"Cloudflare's 2025 Q3 DDoS threat report -- including Aisuru, the apex of botnets",
"Let that sink in. If Aisuru’s attack traffic can disrupt parts of the U.S. Internet infrastructure when said ISPs were not even the target of the attack, imagine what it can do when it’s directly aimed at unprotected or insufficiently protected ISPs,critical infrastructure,healthcare services, emergency services, and military systems.",Denial of Service,Cloudflare Blog,https://blog.cloudflare.com/ddos-threat-report-2025-q3/,"Cloudflare's 2025 Q3 DDoS threat report -- including Aisuru, the apex of botnets",
"“Chunks” of Aisuru are offered by distributors as botnets-for-hire, so anyone can potentially inflict chaos on entire nations by crippling backbone networks and saturating Internet links, disrupting millions of users and impairing access to essential services — all at a cost of a few hundred to a few thousand U.S. dollars.",Denial of Service,Cloudflare Blog,https://blog.cloudflare.com/ddos-threat-report-2025-q3/,"Cloudflare's 2025 Q3 DDoS threat report -- including Aisuru, the apex of botnets",
"Since the start of 2025, Cloudflare has already mitigated 2,867 Aisuru attacks. In the third quarter alone, Cloudflare mitigated 1,304 hyper-volumetric attacks launched by Aisuru. That represents an increase of 54% QoQ. These include the world record-breaking 29.7 Tbps DDoS attack and the 14.1 Bpps DDoS attack.",Denial of Service,Cloudflare Blog,https://blog.cloudflare.com/ddos-threat-report-2025-q3/,"Cloudflare's 2025 Q3 DDoS threat report -- including Aisuru, the apex of botnets",
"The 29.7 Tbps was a UDP carpet-bombing attack bombarding an average of 15K destination ports per second. The distributed attack randomized various packet attributes in an attempt to evade defenses, but Cloudflare’s mitigation systems detected and mitigated all the attacks, including this one, fully autonomously. Read more onHow Cloudflare mitigates hyper-volumetric DDoS attacks.",Denial of Service,Cloudflare Blog,https://blog.cloudflare.com/ddos-threat-report-2025-q3/,"Cloudflare's 2025 Q3 DDoS threat report -- including Aisuru, the apex of botnets",
"While the majority of DDoS attacks are relatively small, in Q3, the amount of DDoS attacks that exceeded 100 million packets per second (Mpps) increased by 189% QoQ. Similarly, attacks exceeding 1 Tbps increased by 227% QoQ. On the HTTP layer, 4 out of every 100 attacks exceeded 1 million requests per second.",Denial of Service,Cloudflare Blog,https://blog.cloudflare.com/ddos-threat-report-2025-q3/,"Cloudflare's 2025 Q3 DDoS threat report -- including Aisuru, the apex of botnets",
"Furthermore, most attacks, 71% of HTTP DDoS and 89% of network-layer, end in under 10 minutes. That's too fast for any human or on-demand service to react. A short attack may only last a few seconds, but the disruption it causes can be severe, and recovery takes far longer. Engineering and operational teams are then stuck with a complex, multi-step process to get critical systems back online, check data for consistency across distributed systems, and restore secure, reliable service to customers.",Denial of Service,Cloudflare Blog,https://blog.cloudflare.com/ddos-threat-report-2025-q3/,"Cloudflare's 2025 Q3 DDoS threat report -- including Aisuru, the apex of botnets",
"The impact of short-lived DDoS attacks, whether hyper-volumetric or not, can extend well beyond the duration of the attack.",Denial of Service,Cloudflare Blog,https://blog.cloudflare.com/ddos-threat-report-2025-q3/,"Cloudflare's 2025 Q3 DDoS threat report -- including Aisuru, the apex of botnets",
"Seven out of the ten top sources are locations within Asia, with Indonesia in the lead. Indonesia is the largest source of DDoS attacks, and it has been ranked number one in the world for an entire year (since 2024 Q3). Even prior to this, Indonesia has always been placed in the top lists of attack sources. In 2024 Q2, Indonesia was the second-largest source, after climbing up from lower ranks in previous quarters and years.",Denial of Service,Cloudflare Blog,https://blog.cloudflare.com/ddos-threat-report-2025-q3/,"Cloudflare's 2025 Q3 DDoS threat report -- including Aisuru, the apex of botnets",
"To illustrate the rise of Indonesia as a DDoS hub, in just five years (since 2021 Q3), the percentage of HTTP DDoS attack requests originating from Indonesia has increased by a staggering 31,900%.",Denial of Service,Cloudflare Blog,https://blog.cloudflare.com/ddos-threat-report-2025-q3/,"Cloudflare's 2025 Q3 DDoS threat report -- including Aisuru, the apex of botnets",
"DDoS attacks against the Mining, Minerals & Metals industry significantly increased in the third quarter of 2025 as the25th European Union–China trade summitsaw rising tensions over Electric Vehicle (EV) tariffs, rare-earth exports, and cybersecurity issues, according to multiple news outlets. The BBCreportedthat “China also raised export controls on rare earths and critical minerals.” Overall, the Mining, Minerals & Metals industry surged 24 spots on the global ranking, making it the 49th most attacked industry in the world.",Denial of Service,Cloudflare Blog,https://blog.cloudflare.com/ddos-threat-report-2025-q3/,"Cloudflare's 2025 Q3 DDoS threat report -- including Aisuru, the apex of botnets",
