text,incident_type,source,source_url,article_title,date
"Two French political parties were attacked shortly before the first round of elections, and a third party was targeted on June 30. This third party, indicated in green on the chart below, faced attacks on the evening of June 29. Several attempts were thwarted by Cloudflare throughout election day, from 10:00 to 23:00 UTC (12:00 to 01:00 local time). The most intense attack occurred at 19:00 UTC (21:00 local time), reaching nearly 40,000 requests per second, with a total of 620 million DDoS requests recorded on that day (June 29).",Denial of Service,Cloudflare Blog,https://blog.cloudflare.com/2024-french-elections-political-cyber-attacks-and-internet-traffic-shifts/,French elections: political cyber attacks and Internet traffic shifts,
"Our data indicates that the most significant attack Cloudflare intercepted targeted a party shown in yellow on the chart above. The party had already been attacked on June 23, 2024, and this subsequent attack happened on July 3 at 21:36 UTC (23:36 local time), lasting four minutes and peaking at 151,000 requests per second (rps), making it the second-largest attack we’ve observed on political parties recently. This was comparable in intensity and duration to another attack on aUK political partyright after their election.",Denial of Service,Cloudflare Blog,https://blog.cloudflare.com/2024-french-elections-political-cyber-attacks-and-internet-traffic-shifts/,French elections: political cyber attacks and Internet traffic shifts,
"On the runoff election day, July 7, the party represented by the blue line was again a target, having been attacked previously on June 24, 27, and 29. The most severe of these occurred on June 27, with attacks reaching 118,000 rps during a day that totaled 610 million daily DDoS requests. On July 7, the attacks resumed, with the first starting at 09:55 UTC (11:55 local time) and continuing sporadically until 23:18 UTC (01:18 local time on July 8). The peak of these attacks came at 11:40 UTC (13:40 local time), reaching 96,000 rps.",Denial of Service,Cloudflare Blog,https://blog.cloudflare.com/2024-french-elections-political-cyber-attacks-and-internet-traffic-shifts/,French elections: political cyber attacks and Internet traffic shifts,
"While these rates may seem small to Cloudflare, they can be devastating for websites not well-protected against such high levels of traffic. DDoS attacks not only overwhelm systems but also serve, if successful, as adistraction for IT teamswhile attackers attempt other types of breaches.",Denial of Service,Cloudflare Blog,https://blog.cloudflare.com/2024-french-elections-political-cyber-attacks-and-internet-traffic-shifts/,French elections: political cyber attacks and Internet traffic shifts,
"During the first round of the French elections on June 30, morning traffic was lower than the previous week and rose in the afternoon. The runoff, a week later, displayed a different pattern. Morning traffic remained stable compared to June 30, but it saw a significant decrease in the afternoon, especially after 17:30 local time. Polling stations in major cities closed at 20:00. At this time, TV media began broadcasting the first results, causing a 16% drop in traffic compared to the previous week. This trend, where traffic dips as initial results are announced, is also seen in other elections, like theUK’s.",Denial of Service,Cloudflare Blog,https://blog.cloudflare.com/2024-french-elections-political-cyber-attacks-and-internet-traffic-shifts/,French elections: political cyber attacks and Internet traffic shifts,
"Traffic shifts during voting day, compared to the previous week, are more revealing when viewed in detail. The map and table below summarize the traffic changes observed at the state level within France, when voting closed and initial results predictions were revealed on TV at around 20:00 local time. This was the moment when, from Cloudflare’s data perspective, attention was diverted from online use.",Denial of Service,Cloudflare Blog,https://blog.cloudflare.com/2024-french-elections-political-cyber-attacks-and-internet-traffic-shifts/,French elections: political cyber attacks and Internet traffic shifts,
"The table below shows the drops in traffic on July 7, at 20:00 local time, compared to the previous week.",Denial of Service,Cloudflare Blog,https://blog.cloudflare.com/2024-french-elections-political-cyber-attacks-and-internet-traffic-shifts/,French elections: political cyber attacks and Internet traffic shifts,
"On election day in France, Internet traffic decreased most significantly in the regions of Bourgogne-Franche-Comté and Grand Est, both in the eastern part of the country and both experiencing a 19% drop. When comparing these regions to the Île-de-France region, where Paris is located, we see a smaller traffic decrease, at 10%. In the south, in regions like Provence-Alpes-Côte d’Azur, the drop was even less pronounced, at 7%.",Denial of Service,Cloudflare Blog,https://blog.cloudflare.com/2024-french-elections-political-cyber-attacks-and-internet-traffic-shifts/,French elections: political cyber attacks and Internet traffic shifts,
"Also notable was the increase in mobile device request traffic share during both election days, driving the share to levels higher than usual. Over the past month, mobile device traffic share on Sundays typically ranged from 53% to 54%. However, it rose to 57% on the first election day, June 30, and increased further to 58% on the runoff day, July 7, 2024. Mobile device traffic share was especially elevated from 11:00 to 22:00 local time on these days.",Denial of Service,Cloudflare Blog,https://blog.cloudflare.com/2024-french-elections-political-cyber-attacks-and-internet-traffic-shifts/,French elections: political cyber attacks and Internet traffic shifts,
"Switching focus to domain trends, our1.1.1.1resolver DNS data reveals a targeted impact from the French elections, allowing for a comparison between the two election days. Analyzing French news media outlets, DNS traffic in France was significantly higher on the first election day, June 30, with a 250% increase at 20:00 local time compared to the previous week. This was 6% higher than on the runoff day, July 7.",Denial of Service,Cloudflare Blog,https://blog.cloudflare.com/2024-french-elections-political-cyber-attacks-and-internet-traffic-shifts/,French elections: political cyber attacks and Internet traffic shifts,
"For French TV domains, the situation reversed during the runoff on July 7, showing 31% more DNS traffic at 20:00 local time than in the first round. On June 30, DNS traffic at that time was already 274% higher than the previous week, but the increase on July 7 was even more significant, at 391% compared to June 23, 2024—the Sunday before the two election days.",Denial of Service,Cloudflare Blog,https://blog.cloudflare.com/2024-french-elections-political-cyber-attacks-and-internet-traffic-shifts/,French elections: political cyber attacks and Internet traffic shifts,
"For microblogging social media in France, traffic was higher during the two election days, peaking on the first round. At the close of voting polls at 20:00 local time on June 30, traffic surged 38% compared to June 23, 2024. On July 7, runoff day, traffic increased by 32% at 20:00 local time compared to June 23, but was 4% lower than on June 30.​",Denial of Service,Cloudflare Blog,https://blog.cloudflare.com/2024-french-elections-political-cyber-attacks-and-internet-traffic-shifts/,French elections: political cyber attacks and Internet traffic shifts,
"In France, more attention was diverted from the Internet during the decisive runoff election day than in the first round, with a noticeable dip in traffic when TV stations announced predicted results at 20:00 local time.",Denial of Service,Cloudflare Blog,https://blog.cloudflare.com/2024-french-elections-political-cyber-attacks-and-internet-traffic-shifts/,French elections: political cyber attacks and Internet traffic shifts,
"The 2024UK general election, the first since Brexit officially began (January 31, 2020) and after 14 years of Conservative leadership, saw the Labour Party secure a majority. This blog post examines Internet traffic trends and cyberattack activity on election day, highlighting notable declines in traffic during the afternoon and evening as well as a DDoS attack on a political party shortly after polls closed.",Denial of Service,Cloudflare Blog,https://blog.cloudflare.com/uk-election-day-2024-traffic-trends-and-attacks-on-political-parties/,UK election day 2024: traffic trends and attacks on political parties,
"Generally,election daysdo not result in drastic changes to Internet traffic. Traffic typically dips during voting hours but not as sharply as during major events like national holidays, and rises in the evening as results are announced.",Denial of Service,Cloudflare Blog,https://blog.cloudflare.com/uk-election-day-2024-traffic-trends-and-attacks-on-political-parties/,UK election day 2024: traffic trends and attacks on political parties,
"On July 4, 2024, traffic initially rose slightly from the previous week, then fell around noon (-2%). Significant declines began only after 16:00, with noticeable drops at 16:45 and again at 22:00 as polls closed.",Denial of Service,Cloudflare Blog,https://blog.cloudflare.com/uk-election-day-2024-traffic-trends-and-attacks-on-political-parties/,UK election day 2024: traffic trends and attacks on political parties,
"Traffic shifts during voting day, compared to the previous week, are more revealing when viewed in detail. The map and table below summarize the traffic changes observed at the country level within the UK, where the greatest impact was observed in Northern Ireland (-10%), followed by Scotland (-6%), Wales (-5%), and England (-3%), all after 16:00.",Denial of Service,Cloudflare Blog,https://blog.cloudflare.com/uk-election-day-2024-traffic-trends-and-attacks-on-political-parties/,UK election day 2024: traffic trends and attacks on political parties,
"Next, examining the day’s traffic changes, we observed a clear drop in Northern Ireland around 13:00 local time and during off-work hours between 16:00 and 20:00, before it began to increase again.",Denial of Service,Cloudflare Blog,https://blog.cloudflare.com/uk-election-day-2024-traffic-trends-and-attacks-on-political-parties/,UK election day 2024: traffic trends and attacks on political parties,
"In Scotland, traffic fell by about 5% from 16:00 to 21:00 local time compared to the previous week.",Denial of Service,Cloudflare Blog,https://blog.cloudflare.com/uk-election-day-2024-traffic-trends-and-attacks-on-political-parties/,UK election day 2024: traffic trends and attacks on political parties,
"And in England, traffic decreased by approximately 3% between 16:00 and 18:00 and about 2% between 20:00 and 22:00.",Denial of Service,Cloudflare Blog,https://blog.cloudflare.com/uk-election-day-2024-traffic-trends-and-attacks-on-political-parties/,UK election day 2024: traffic trends and attacks on political parties,
"In all the countries within the UK, traffic clearly increased after 23:00 local time when the voting polls had already closed and the first results started to arrive. Peak increases were reached at different times: Wales saw a 3% increase at 01:00; Northern Ireland and England experienced their highest increases of 12% and 11% respectively at 02:00; and Scotland had a 9% increase at 02:00 followed by a 12% spike at 04:00.",Denial of Service,Cloudflare Blog,https://blog.cloudflare.com/uk-election-day-2024-traffic-trends-and-attacks-on-political-parties/,UK election day 2024: traffic trends and attacks on political parties,
"Switching focus to domain trends, our1.1.1.1resolver DNS data reveals a more targeted impact from the UK elections. Analyzing the participating parties, DNS traffic significantly increased on election day, peaking at 22:00 and midnight local time (up to 600% growth), and then again at 04:00 (671%).",Denial of Service,Cloudflare Blog,https://blog.cloudflare.com/uk-election-day-2024-traffic-trends-and-attacks-on-political-parties/,UK election day 2024: traffic trends and attacks on political parties,
"Among the main parties, Labour, led by Keir Starmer, outperformed the Conservative Party on election day. Labour’s DNS traffic spiked at 22:00 local time, with an 866% increase from the previous week.",Denial of Service,Cloudflare Blog,https://blog.cloudflare.com/uk-election-day-2024-traffic-trends-and-attacks-on-political-parties/,UK election day 2024: traffic trends and attacks on political parties,
"Analyzing official government and election-related websites, the UK differs from other countries in how results are shared. Official results weren’t continuously updated as they came in. The largest spike in DNS traffic, a 172% increase from the previous week, occurred on election morning around 07:00 local time. This increase likely happened because UK citizens were searching for the correct polling stations and other voting resources.",Denial of Service,Cloudflare Blog,https://blog.cloudflare.com/uk-election-day-2024-traffic-trends-and-attacks-on-political-parties/,UK election day 2024: traffic trends and attacks on political parties,
"News sites and microblogging social media platforms in the UK experienced significant increases in usage after the polling stations closed at 22:00 local time. In the UK, news sites not only provide initial projections but also final results. DNS traffic for UK news media outlets surged 74% compared to the previous week, peaking at 104% at midnight and 04:00.",Denial of Service,Cloudflare Blog,https://blog.cloudflare.com/uk-election-day-2024-traffic-trends-and-attacks-on-political-parties/,UK election day 2024: traffic trends and attacks on political parties,
"For microblogging social media in Great Britain, traffic was already 25% higher than the previous week when the polls closed (22:00), peaking at 27% at midnight and remaining elevated through the night.",Denial of Service,Cloudflare Blog,https://blog.cloudflare.com/uk-election-day-2024-traffic-trends-and-attacks-on-political-parties/,UK election day 2024: traffic trends and attacks on political parties,
"We saw last week in the US, during the Biden vs Trump debate, that video streaming social platforms such as YouTube or TikTok, were used to watch through news outlets channels the debate live, with DNS traffic surging. How about the UK? DNS traffic was 10% higher than in the previous week starting at midnight, and at 01:00 local time was 15% higher.",Denial of Service,Cloudflare Blog,https://blog.cloudflare.com/uk-election-day-2024-traffic-trends-and-attacks-on-political-parties/,UK election day 2024: traffic trends and attacks on political parties,
"Focusing on attacks, those are usually constant, and aren’t necessarily driven always by elections. But, as we’ve seen at the start of thewar in Ukraineor more recently in theNetherlandsor inFrance, specific events do trigger attacks. DDoS (Distributed Denial of Service) attacks remain a common method employed by attackers.",Denial of Service,Cloudflare Blog,https://blog.cloudflare.com/uk-election-day-2024-traffic-trends-and-attacks-on-political-parties/,UK election day 2024: traffic trends and attacks on political parties,
"In recent days, there has been DDoS activity targeting political parties in the UK that participated in these elections. Our data shows that two parties experienced attacks that were blocked by Cloudflare. One party, represented in blue, suffered an attack on June 16, which lasted over four hours and peaked at 60,000 requests per second (rps).",Denial of Service,Cloudflare Blog,https://blog.cloudflare.com/uk-election-day-2024-traffic-trends-and-attacks-on-political-parties/,UK election day 2024: traffic trends and attacks on political parties,
"The party shown in yellow was hit by four DDoS attacks on different days: June 13, 19, 26, and in the early hours of July 5 (UTC), just after the election’s first predictions were broadcast, giving a majority to the Labour Party. This was the most significant attack in recent days, peaking at 156,000 rps. It began at 01:47 local time (00:47 UTC) and ended four minutes later. Here’s a closer look at that July 5, 2024, attack:",Denial of Service,Cloudflare Blog,https://blog.cloudflare.com/uk-election-day-2024-traffic-trends-and-attacks-on-political-parties/,UK election day 2024: traffic trends and attacks on political parties,
"Although these rates are small on Cloudflare’s scale, they can be devastating for unprotected websites unaccustomed to such levels of traffic.",Denial of Service,Cloudflare Blog,https://blog.cloudflare.com/uk-election-day-2024-traffic-trends-and-attacks-on-political-parties/,UK election day 2024: traffic trends and attacks on political parties,
"Even if major political events don’t always bring notable changes to Internet traffic, our data shows that in the UK, traffic decreased more significantly in the afternoon and evening, especially as voting stations remained open until 22:00.",Denial of Service,Cloudflare Blog,https://blog.cloudflare.com/uk-election-day-2024-traffic-trends-and-attacks-on-political-parties/,UK election day 2024: traffic trends and attacks on political parties,
"We also observed attacks targeting political parties in the UK, further highlighting that this election year is marked by cyberattacks aimed at influencing politically related websites.",Denial of Service,Cloudflare Blog,https://blog.cloudflare.com/uk-election-day-2024-traffic-trends-and-attacks-on-political-parties/,UK election day 2024: traffic trends and attacks on political parties,
"France is currently electing a new government through early legislative elections that began on Sunday, June 30, 2024, with a second round scheduled for July 7. In this blog, we show how Cloudflare blocked DDoS attacks targeting three different French political parties.",Denial of Service,Cloudflare Blog,https://blog.cloudflare.com/first-round-of-french-election-2024-party-attacks-and-a-modest-traffic-dip/,First round of French election: party attacks and a modest traffic dip,
"Recently in France, as in the early stages of thewar in Ukraineand duringEU elections in the Netherlands, political events have precipitated cyberattacks. In France, several DDoS (Distributed Denial of Service attack) attacks targeted political parties involved in the elections over the past few days, with two parties hit just before the first round and another on election day itself.",Denial of Service,Cloudflare Blog,https://blog.cloudflare.com/first-round-of-french-election-2024-party-attacks-and-a-modest-traffic-dip/,First round of French election: party attacks and a modest traffic dip,
"The first political party, shown in yellow in the previous chart, experienced a DDoS attack on June 23, 2024, peaking at 68,000 requests per second (rps); it also endured a second DDoS attack on June 29, the day before the election, peaking at 20,000 rps. Although these rates are small on Cloudflare’s scale, they can be devastating for unprotected websites unaccustomed to such levels of traffic.",Denial of Service,Cloudflare Blog,https://blog.cloudflare.com/first-round-of-french-election-2024-party-attacks-and-a-modest-traffic-dip/,First round of French election: party attacks and a modest traffic dip,
"The second party, represented by the blue line, was targeted on June 24, June 27, and June 29, 2024, with the most severe attack occurring on June 27, reaching 118,000 rps during a day marked by frequent DDoS spikes that had in total 610 million daily requests.",Denial of Service,Cloudflare Blog,https://blog.cloudflare.com/first-round-of-french-election-2024-party-attacks-and-a-modest-traffic-dip/,First round of French election: party attacks and a modest traffic dip,
"The third party was attacked on the evening of June 29 in France, with several attempts blocked by Cloudflare on election day, June 30, between 10:00 and 23:00 UTC (12:00 and 01:00 local time). The peak activity targeting this party hit nearly 40,000 rps at 19:00 UTC (21:00 local time), with a total of 620 million daily DDoS requests on election day.",Denial of Service,Cloudflare Blog,https://blog.cloudflare.com/first-round-of-french-election-2024-party-attacks-and-a-modest-traffic-dip/,First round of French election: party attacks and a modest traffic dip,
"During the first round of the election this past Sunday, June 30, 2024, Internet traffic was initially higher than the previous week but dropped by as much as 3% at 11:30 local time (09:30 UTC) after the polls opened. Traffic began to increase again after 17:45 local time (15:45 UTC) and peaked at 20:00 local time (18:00 UTC) when the polls closed and the first projections were announced.",Denial of Service,Cloudflare Blog,https://blog.cloudflare.com/first-round-of-french-election-2024-party-attacks-and-a-modest-traffic-dip/,First round of French election: party attacks and a modest traffic dip,
"Football (“soccer” in the US) is considered the most popular sport in the world, with around3.5 billion fansspread across the world. European football is central to its popularity. TheUEFA Euro 2024(the European Football Championship) started on June 14 and will run until July 14, 2024. But how much do these games impact Internet traffic in countries where national teams are playing? That’s what we aim to explore in this blog post. We found that, on average, traffic dropped 6% during games in European countries with national teams playing in the tournament.",Denial of Service,Cloudflare Blog,https://blog.cloudflare.com/how-uefa-euro-2024-football-games-impact-internet-traffic/,How the UEFA Euro 2024 football games are impacting local Internet traffic,
"Cloudflare has a global presence with data centers in over 320 cities, which helps provide a global view of what’s happening on the Internet. This is helpful for security, privacy, efficiency, and speed purposes, but also for observing Internetdisruptionsandtraffic trends.",Denial of Service,Cloudflare Blog,https://blog.cloudflare.com/how-uefa-euro-2024-football-games-impact-internet-traffic/,How the UEFA Euro 2024 football games are impacting local Internet traffic,
"In the past, we’ve seen how Internet traffic and HTTP requests are impacted by events such astotal solar eclipses, theSuper Bowl, andelections. 2024 is the year of elections, and we’ve been sharing our observations inblog postsand our new 2024Election Insights reporton Cloudflare Radar.",Denial of Service,Cloudflare Blog,https://blog.cloudflare.com/how-uefa-euro-2024-football-games-impact-internet-traffic/,How the UEFA Euro 2024 football games are impacting local Internet traffic,
"However, football games are different from elections. Related trends happen when major teams or national squads are playing matches that draw a lot of human attention. If a game is broadcast on a national TV channel, Internet traffic typically drops because during games. People’s attention is more on the TV set with the ‘old’ broadcast signal, for those games that don’t require a paid subscription. That’s the most common situation when national teams are playing in Europe.",Denial of Service,Cloudflare Blog,https://blog.cloudflare.com/how-uefa-euro-2024-football-games-impact-internet-traffic/,How the UEFA Euro 2024 football games are impacting local Internet traffic,
"If it’s on a closed or paid channel (where a subscription is needed), then sometimes traffic increases as fewer viewers have access to the TV broadcast. For context, there’s a trend of channels offering games in their apps through streaming, not only for paid channels but also national broadcasters such as the British BBC. The opening England game in Euro 2024 on Sunday, June 16, 2024, had15 million viewers on BBCOne and was also streamed 3.5 million times on BBC iPlayer. This variety of viewing options from a single service appears to be a new trend in the digital age.",Denial of Service,Cloudflare Blog,https://blog.cloudflare.com/how-uefa-euro-2024-football-games-impact-internet-traffic/,How the UEFA Euro 2024 football games are impacting local Internet traffic,
"Here is the full list, which provides more detail than the map above, showing each country and the percentage decrease (or increase) in traffic as compared to the previous week at the time those countries’ national team games were occurring.",Denial of Service,Cloudflare Blog,https://blog.cloudflare.com/how-uefa-euro-2024-football-games-impact-internet-traffic/,How the UEFA Euro 2024 football games are impacting local Internet traffic,
"We’ve also noticed looking at our country-relatedHTTPdata around games that social media services usually go up during half-time and before and after these national team games. As expected, traffic to websites in categories like AI chatbots, ecommerce (though some see increases during halftime), productivity tools, and business and financial services tends to decrease during Euro 2024 games.",Denial of Service,Cloudflare Blog,https://blog.cloudflare.com/how-uefa-euro-2024-football-games-impact-internet-traffic/,How the UEFA Euro 2024 football games are impacting local Internet traffic,
"Another important perspective is focused on the first day of competition. On June 14, 2024, Euro 2024 kicked off in Germany. How was Internet traffic impacted in the country?",Denial of Service,Cloudflare Blog,https://blog.cloudflare.com/how-uefa-euro-2024-football-games-impact-internet-traffic/,How the UEFA Euro 2024 football games are impacting local Internet traffic,
