text,incident_type,source,source_url,article_title,date
"In the second half of April 2025, Cloudflare’s systems automatically detected and blocked dozens of hyper-volumetric DDoS attacks as part of an intense campaign. The largest attacks peaked at 4.8 Bpps and 6.5 Tbps, with these massive surges typically lasting between 35 and 45 seconds. At 6.5 Tbps, this attack matches thelargest publicly disclosed DDoS attackto date. The 4.8 Bpps attack is the largest ever to be disclosed from the packet intensity perspective, approximately 52% larger than the previous 3.15 Bpps record.",Denial of Service,Cloudflare Blog,https://blog.cloudflare.com/ddos-threat-report-for-2025-q1/,"Targeted by 20.5 million DDoS attacks, up 358% year-over-year: Cloudflare’s 2025 Q1 DDoS Threat Report",
The attacks originated from 147 countries and targeted multiple IP addresses and ports of a hosting provider that is protected by CloudflareMagic Transit. All the attacks were successfully blocked by Cloudflare’s network.,Denial of Service,Cloudflare Blog,https://blog.cloudflare.com/ddos-threat-report-for-2025-q1/,"Targeted by 20.5 million DDoS attacks, up 358% year-over-year: Cloudflare’s 2025 Q1 DDoS Threat Report",
"When surveying Cloudflare customers that were targeted by DDoS attacks, the majority said they didn’t know who attacked them. The ones that did know reported their competitors as the number one threat actor behind the attacks (39%), which is similar to last quarter. This is quite common in the gaming and gambling industry.",Denial of Service,Cloudflare Blog,https://blog.cloudflare.com/ddos-threat-report-for-2025-q1/,"Targeted by 20.5 million DDoS attacks, up 358% year-over-year: Cloudflare’s 2025 Q1 DDoS Threat Report",
"Another 17% reported that a state-level or state-sponsored threat actor was behind the attack, and a similar percentage reported that a disgruntled user or customer was behind the attack.",Denial of Service,Cloudflare Blog,https://blog.cloudflare.com/ddos-threat-report-for-2025-q1/,"Targeted by 20.5 million DDoS attacks, up 358% year-over-year: Cloudflare’s 2025 Q1 DDoS Threat Report",
Another 11% reported that they mistakenly inflicted the DDoS attack on themselves (self-DDoS) and a similar percentage said an extortionist was behind the attacks. 6% reported that the attacks were launched by disgruntled or former employees.,Denial of Service,Cloudflare Blog,https://blog.cloudflare.com/ddos-threat-report-for-2025-q1/,"Targeted by 20.5 million DDoS attacks, up 358% year-over-year: Cloudflare’s 2025 Q1 DDoS Threat Report",
"On the network-layer,SYN floodremains the most common Layer 3/4 DDoS attack vector, followed byDNS floodattacks.Mirai-launched DDoS attacks take the third place, replacingUDP floodattacks.",Denial of Service,Cloudflare Blog,https://blog.cloudflare.com/ddos-threat-report-for-2025-q1/,"Targeted by 20.5 million DDoS attacks, up 358% year-over-year: Cloudflare’s 2025 Q1 DDoS Threat Report",
"In the HTTP realm, over 60% of the attacks were identified and blocked as known botnets, 21% were attacks with suspicious HTTP attributes, another 10% were launched by botnets impersonating browsers, and the remaining 8% were generic floods, attacks of unusual request patterns, and cache busting attacks.",Denial of Service,Cloudflare Blog,https://blog.cloudflare.com/ddos-threat-report-for-2025-q1/,"Targeted by 20.5 million DDoS attacks, up 358% year-over-year: Cloudflare’s 2025 Q1 DDoS Threat Report",
"In 2025 Q1, we saw a 3,488% QoQ increase in CLDAP reflection/amplification attacks.CLDAP (Connectionless Lightweight Directory Access Protocol)is a variant ofLDAP (Lightweight Directory Access Protocol), used for querying and modifying directory services running over IP networks. CLDAP is connectionless, using UDP instead of TCP, making it faster but less reliable. Because it uses UDP, there’s no handshake requirement, which allows attackers to spoof the source IP address, thus allowing attackers to exploit it as a reflection vector. In these attacks, small queries are sent with a spoofed source IP address (the victim's IP), causing servers to send large responses to the victim, overwhelming it. Mitigation involves filtering and monitoring unusual CLDAP traffic.",Denial of Service,Cloudflare Blog,https://blog.cloudflare.com/ddos-threat-report-for-2025-q1/,"Targeted by 20.5 million DDoS attacks, up 358% year-over-year: Cloudflare’s 2025 Q1 DDoS Threat Report",
"We also saw a 2,301% QoQ increase in ESP reflection/amplification attacks. The ESP (Encapsulating Security Payload) protocol is part ofIPsecand provides confidentiality, authentication, and integrity to network communications. However, it can be abused in DDoS attacks if malicious actors exploit misconfigured or vulnerable systems to reflect or amplify traffic towards a target, leading to service disruption. Like with other protocols, securing and properly configuring the systems using ESP is crucial to block the risks of DDoS attacks.",Denial of Service,Cloudflare Blog,https://blog.cloudflare.com/ddos-threat-report-for-2025-q1/,"Targeted by 20.5 million DDoS attacks, up 358% year-over-year: Cloudflare’s 2025 Q1 DDoS Threat Report",
"Despite the increase in hyper-volumetric attacks, most DDoS attacks are small. In 2025 Q1, 99% of Layer 3/4 DDoS attacks were under 1 Gbps and 1 Mpps. Similarly, 94% of HTTP DDoS attacks were 1 million requests per second (rps). However, ‘small’ is a relative term and most Internet properties wouldn’t be able to withstand even those small attacks. They can easily saturate unprotected Internet links and crash unprotected servers.",Denial of Service,Cloudflare Blog,https://blog.cloudflare.com/ddos-threat-report-for-2025-q1/,"Targeted by 20.5 million DDoS attacks, up 358% year-over-year: Cloudflare’s 2025 Q1 DDoS Threat Report",
"Furthermore, most attacks are very short-lived. 89% of Layer 3/4 DDoS attacks and 75% of HTTP DDoS attacks end within 10 minutes. Even the largest, record-breaking, hyper-volumetric DDoS attacks can be very short, such as the 35-second attack seen in the examples above. 35 seconds, or even 10 minutes, is not a sufficient time for manual mitigation or activating an on-demand solution: by the time a security analyst receives the alert, and analyzes the attack, it’s already over. And while the attacks may be very short, the trickle effect of attack leads to network and applications failures that can take days to recover from — all whilst services are down or degraded. The current threat landscape leaves no time for human intervention. Detection and mitigation should be always-on, in-line and automated — with sufficient capacity and global coverage to handle the attack traffic along with legitimate peak time traffic.",Denial of Service,Cloudflare Blog,https://blog.cloudflare.com/ddos-threat-report-for-2025-q1/,"Targeted by 20.5 million DDoS attacks, up 358% year-over-year: Cloudflare’s 2025 Q1 DDoS Threat Report",
"On the other hand, hyper-volumetric HTTP DDoS attacks that exceed 1 Mrps doubled their share. In 2025 Q1, 6 out of every 100 HTTP DDoS attacks exceeded 1 Mrps. On the network-layer, 1 out of every 100,000 attacks exceeded 1 Tbps or 1 Bpps.",Denial of Service,Cloudflare Blog,https://blog.cloudflare.com/ddos-threat-report-for-2025-q1/,"Targeted by 20.5 million DDoS attacks, up 358% year-over-year: Cloudflare’s 2025 Q1 DDoS Threat Report",
"One example of such an attack targeted aCloudflare Magic Transitcustomer. The customer itself is a US-based hosting provider that offers web servers,Voice over IP (VoIP)servers, and game servers amongst its solutions. This specific attack targeted port 27015. This port is most commonly associated with multiplayer gaming servers, especially Valve's Source engine games, such as Counter-Strike: Global Offensive (CS:GO), Team Fortress 2, Garry's Mod, Left 4 Dead, and Half-Life 2: Deathmatch.",Denial of Service,Cloudflare Blog,https://blog.cloudflare.com/ddos-threat-report-for-2025-q1/,"Targeted by 20.5 million DDoS attacks, up 358% year-over-year: Cloudflare’s 2025 Q1 DDoS Threat Report",
"It's used for the game server connection, letting clients connect to the server to play online. In many cases, this port is open for both UDP and TCP, depending on the game and what kind of communication it's doing. This customer was targeted with multiple hyper-volumetric attacks that were autonomously blocked by Cloudflare.",Denial of Service,Cloudflare Blog,https://blog.cloudflare.com/ddos-threat-report-for-2025-q1/,"Targeted by 20.5 million DDoS attacks, up 358% year-over-year: Cloudflare’s 2025 Q1 DDoS Threat Report",
"The first quarter of 2025 saw a significant shift in the top 10most attacked locationsglobally. Germany made a notable jump, climbing four spots — making it the most attacked country. In second place, Turkey also experienced a surge of 11 spots. In third, China, on the other hand, slipped two spots compared to the previous quarter, while Hong Kong remained unchanged. India rose four spots, and Brazil stayed the same. Taiwan dropped four positions. The Philippines experienced the largest decline, falling 6 spots. South Korea and Indonesia, however, both jumped up by two spots each.",Denial of Service,Cloudflare Blog,https://blog.cloudflare.com/ddos-threat-report-for-2025-q1/,"Targeted by 20.5 million DDoS attacks, up 358% year-over-year: Cloudflare’s 2025 Q1 DDoS Threat Report",
"The top 10most attacked industriesin 2025 Q1 saw some notable changes. The Gambling & Casinos industry jumped up four spots as the most attacked industry, while the Telecommunications, Service Providers and Carriers industry slid down one spot. The Information Technology & Services and Internet industries both saw minor fluctuations, moving up one and down two spots, respectively. The Gaming andBanking & Financial Services industriesboth saw a one-spot increase, while the Cyber Security industry made a massive leap of 37 spots compared to the previous quarter. Retail saw a slight decline of one spot, while the Manufacturing, Machinery, Technology & Engineering industry surged 28 spots. The Airlines, Aviation & Aerospace industry had the biggest jump of all, moving up 40 spots making it the tenth most attacked industry.",Denial of Service,Cloudflare Blog,https://blog.cloudflare.com/ddos-threat-report-for-2025-q1/,"Targeted by 20.5 million DDoS attacks, up 358% year-over-year: Cloudflare’s 2025 Q1 DDoS Threat Report",
"The ranking of the top 10largest sources of DDoS attacksin 2025 Q1 also shifted notably. Hong Kong soared to the number one position, climbing three spots from the previous quarter. Indonesia edged down to second place, while Argentina rose two spots to third. Singapore slipped two spots to fourth, and Ukraine dropped one to fifth. Brazil made a striking leap, climbing seven places to land in sixth place, closely followed by Thailand, which also rose seven spots to seventh. Germany also increased, moving up two positions to eighth. Vietnam made the most dramatic climb, jumping 15 spots to claim ninth place, while Bulgaria rounded out the list, dipping two spots to tenth.",Denial of Service,Cloudflare Blog,https://blog.cloudflare.com/ddos-threat-report-for-2025-q1/,"Targeted by 20.5 million DDoS attacks, up 358% year-over-year: Cloudflare’s 2025 Q1 DDoS Threat Report",
"When looking at where the DDoS attacks originate from, specifically HTTP DDoS attacks, there are a few autonomous systems that stand out. In 2025 Q1, the German-basedHetzner (AS24940)retained its position as the largest source of HTTP DDoS attacks. It was followed by the French-basedOVH (AS16276)in second, the US-basedDigitalOcean (AS14061)in third, and another German-based provider,Contabo (AS51167), in fourth.",Denial of Service,Cloudflare Blog,https://blog.cloudflare.com/ddos-threat-report-for-2025-q1/,"Targeted by 20.5 million DDoS attacks, up 358% year-over-year: Cloudflare’s 2025 Q1 DDoS Threat Report",
"Other major sources included the China-basedChinaNet Backbone (AS4134)andTencent (AS132203), the Austrian-basedDrei (AS200373), and three US-based providers to wrap up the top 10 —Microsoft (AS8075),Oracle (AS31898), andGoogle Cloud Platform (AS396982). Most of the networks in this ranking are well-known cloud computing or hosting providers, highlighting how cloud infrastructure is frequently leveraged — either intentionally or through exploitation — for launching DDoS attacks.",Denial of Service,Cloudflare Blog,https://blog.cloudflare.com/ddos-threat-report-for-2025-q1/,"Targeted by 20.5 million DDoS attacks, up 358% year-over-year: Cloudflare’s 2025 Q1 DDoS Threat Report",
"To help hosting providers, cloud computing providers and any Internet service providers identify and take down the abusive accounts that launch these attacks, we leverage Cloudflare’s unique vantage point to provide afree DDoS Botnet Threat Feed for Service Providers. Over 600 organizations worldwide have already signed up for this feed. It gives service providers a list of offending IP addresses from within their ASN that we see launching HTTP DDoS attacks. It’s completely free and all it takes is opening a free Cloudflare account, authenticating the ASN viaPeeringDB, and thenfetching the threat intelligence via API.",Denial of Service,Cloudflare Blog,https://blog.cloudflare.com/ddos-threat-report-for-2025-q1/,"Targeted by 20.5 million DDoS attacks, up 358% year-over-year: Cloudflare’s 2025 Q1 DDoS Threat Report",
"As the threat landscape continues to evolve, we see that many organizations still adopt DDoS protection only after experiencing an attack or rely on outdated, on-demand solutions. In contrast, our data shows that those with proactive security strategies are far more resilient. That’s why we focus on automation and a comprehensive, always-on, in-line security approach to stay ahead of both existing and emerging threats.",Denial of Service,Cloudflare Blog,https://blog.cloudflare.com/ddos-threat-report-for-2025-q1/,"Targeted by 20.5 million DDoS attacks, up 358% year-over-year: Cloudflare’s 2025 Q1 DDoS Threat Report",
"Backed by our global network with 348 Tbps of capacity spanning 335 cities, we remain dedicated to delivering unmetered, unlimited DDoS protection, regardless of the size, duration, or frequency of attacks.",Denial of Service,Cloudflare Blog,https://blog.cloudflare.com/ddos-threat-report-for-2025-q1/,"Targeted by 20.5 million DDoS attacks, up 358% year-over-year: Cloudflare’s 2025 Q1 DDoS Threat Report",
"Security and attacks continues to be a very active environment, and the visibility that Cloudflare Radar provides on this dynamic landscape has evolved and expanded over time. To that end, during 2023’s Security Week, welaunched our URL Scanner, which enables users to safely scan any URL to determine if it is safe to view or interact with. During 2024’s Security Week, welaunched an Email Security page, which provides a unique perspective on the threats posed by malicious emails, spam volume, the adoption ofemail authentication methods like SPF, DMARC, and DKIM, and the use of IPv4/IPv6 and TLS by email servers. For Security Week 2025, we are adding several new DDoS-focused graphs, new insights into leaked credential trends, and a newBotspage to Cloudflare Radar.  We are also taking this opportunity torefactorRadar’sSecurity & Attackspage, breaking it out intoApplication LayerandNetwork Layersections.",Denial of Service,Cloudflare Blog,https://blog.cloudflare.com/cloudflare-radar-ddos-leaked-credentials-bots/,"Extending Cloudflare Radar’s security insights with new DDoS, leaked credentials, and bots datasets",
"Since Cloudflare Radar launched in 2020, it has included both network layer (Layers 3 & 4) and application layer (Layer 7) attack traffic insights on a singleSecurity & Attackspage. Over the last four-plus years, we have evolved some of the existing data sets on the page, as well as adding new ones. As the page has grown and improved over time, it risked becoming unwieldy to navigate, making it hard to find the graphs and data of interest. To help address that, theSecuritysection on Radar now features separateApplication LayerandNetwork Layerpages. TheApplication Layerpage is the default, and includes insights from analysis of HTTP-based malicious and attack traffic. TheNetwork Layerpage includes insights from analysis of network and transport layer attacks, as well as observedTCP resets and timeouts. Future security and attack-related data sets will be added to the relevant page.Email Securityremains on its own dedicated page.",Denial of Service,Cloudflare Blog,https://blog.cloudflare.com/cloudflare-radar-ddos-leaked-credentials-bots/,"Extending Cloudflare Radar’s security insights with new DDoS, leaked credentials, and bots datasets",
"Radar’squarterly DDoS threat reportshave historically provided insights, aggregated on a quarterly basis, into the top source and target locations of application layer DDoS attacks. Anew map and tableon Radar’sApplication LayerSecurity page now provide more timely insights, with a global choropleth map showing a geographical distribution of source and target locations, and an accompanying list of the top 20 locations by share of all DDoS requests. Source location attribution continues to rely on the geolocation of the IP address originating the blocked request, while target location remains the billing location of the account that owns the site being attacked.",Denial of Service,Cloudflare Blog,https://blog.cloudflare.com/cloudflare-radar-ddos-leaked-credentials-bots/,"Extending Cloudflare Radar’s security insights with new DDoS, leaked credentials, and bots datasets",
"Over the first week of March 2025, the United States, Indonesia, and Germany were the top sources ofapplication layer DDoS attacks, together accounting for over 30% of such attacks as shown below. The concentration across the top targeted locations was quite different, with customers from Canada, the United States, and Singapore attracting 56% of application layer DDoS attacks.",Denial of Service,Cloudflare Blog,https://blog.cloudflare.com/cloudflare-radar-ddos-leaked-credentials-bots/,"Extending Cloudflare Radar’s security insights with new DDoS, leaked credentials, and bots datasets",
"In addition to extended visibility into the geographic source of application layer DDoS attacks, we have also addedautonomous system (AS)-level visibility. Anew treemapview shows the distribution of these attacks by source AS. At a global level, the largest sources include cloud/hosting providers in Germany, the United States, China, and Vietnam.",Denial of Service,Cloudflare Blog,https://blog.cloudflare.com/cloudflare-radar-ddos-leaked-credentials-bots/,"Extending Cloudflare Radar’s security insights with new DDoS, leaked credentials, and bots datasets",
"For a selected country/region, the treemap displays a source AS distribution for attacks observed to be originating from that location. In some, the sources of attack traffic are heavily concentrated in consumer/business network providers, such as inPortugal, shown below. However, in other countries/regions that have a large cloud provider presence, such asIreland,Singapore, and theUnited States, ASNs associated with these types of providers are the dominant sources. To that end, Singapore was listed as being among the top sources of application layer DDoS attacks in each of the quarterly DDoS threat reports in 2024.",Denial of Service,Cloudflare Blog,https://blog.cloudflare.com/cloudflare-radar-ddos-leaked-credentials-bots/,"Extending Cloudflare Radar’s security insights with new DDoS, leaked credentials, and bots datasets",
"Leaked credentials detectionscans incoming HTTP requests for known authentication patterns from common web apps and any custom detection locations that were configured. The service uses a privacy-preserving compromised credential checking protocol to compare a hash of the detected passwords to hashes of compromised passwords found in databases of leaked credentials. Anew Radar graphon the worldwideApplication LayerSecurity page provides visibility into aggregate trends around the detection of leaked credentials in authentication requests. Filterable by authentication requests from human users, bots, or all (human + bot), the graph shows the distribution requests classified as “clean” (no leaked credentials detected) and “compromised” (leaked credentials, as defined above, were used). At a worldwide level, we found that for the first week of March 2025, leaked credentials were used in 64% of all, over 65% of bot, and over 44% of human authorization requests.",Denial of Service,Cloudflare Blog,https://blog.cloudflare.com/cloudflare-radar-ddos-leaked-credentials-bots/,"Extending Cloudflare Radar’s security insights with new DDoS, leaked credentials, and bots datasets",
"This suggests that from a human perspective, password reuse is still a problem, as is users not taking immediate actions to change passwords when notified of a breach. And from a bot perspective, this suggests that attackers know that there is a good chance that leaked credentials for one website or application will enable them to access that same user’s account elsewhere.",Denial of Service,Cloudflare Blog,https://blog.cloudflare.com/cloudflare-radar-ddos-leaked-credentials-bots/,"Extending Cloudflare Radar’s security insights with new DDoS, leaked credentials, and bots datasets",
"As a complement to the leaked credentials data, Radar is also now providing a worldwide view into theshare of authentication requests originating from bots. Note that not all of these requests are necessarily malicious — while some may be associated withcredential stuffing-style attacks, others may be from automated scripts or other benign applications accessing an authentication endpoint. (Having said that, automated malicious attack request volume far exceeds legitimate automated login attempts.) During the first week of March 2025, we found that over 94% of authentication requests came from bots (were automated), with the balance coming from humans. Over that same period,bot traffic only accounted for 30% of overall requests. So although bots don’t represent a majority of request traffic, authentication requests appear to comprise a significant portion of their activity.",Denial of Service,Cloudflare Blog,https://blog.cloudflare.com/cloudflare-radar-ddos-leaked-credentials-bots/,"Extending Cloudflare Radar’s security insights with new DDoS, leaked credentials, and bots datasets",
"As a reminder,bottraffic describes any non-human Internet traffic, and monitoring bot levels can help spot potential malicious activities. Of course, bots can be helpful too, and Cloudflare maintains a list ofverified botsto help keep the Internet healthy. Given the importance of monitoring bot activity, we have launched a new dedicatedBotspage in the Traffic section of Cloudflare Radar to support these efforts. For both worldwide and location views over the selected time period, the page shows the distribution of bot (automated) vs. human HTTP requests, as well as a graph showing bot traffic trends. (Ourbot score, combining machine learning, heuristics, and other techniques, is used to identify automated requests likely to be coming from bots.)",Denial of Service,Cloudflare Blog,https://blog.cloudflare.com/cloudflare-radar-ddos-leaked-credentials-bots/,"Extending Cloudflare Radar’s security insights with new DDoS, leaked credentials, and bots datasets",
"Both the2023and2024Cloudflare Radar Year in Review microsites included a “Bot Traffic Sources” section, showing the locations and networks that Cloudflare determined that the largest shares ofautomated/likely automatedtraffic was originating from. However, these traffic shares were published just once a year, aggregating traffic from January through the end of November.",Denial of Service,Cloudflare Blog,https://blog.cloudflare.com/cloudflare-radar-ddos-leaked-credentials-bots/,"Extending Cloudflare Radar’s security insights with new DDoS, leaked credentials, and bots datasets",
"In order to provide a more timely perspective, these insights are now available on the new Radar Bots page. Similar to the newDDoS attackscontent discussed above, theworldwide viewincludes a choropleth map and table illustrating the locations originating the largest shares of all bot traffic. (Note that a similarTraffic Characteristicsmap and table on theTraffic Overview pageranks locations by the bot traffic share of the location’s total traffic.) Similar to Year in Review data linked above, the United States continues to originate the largest share of bot traffic.",Denial of Service,Cloudflare Blog,https://blog.cloudflare.com/cloudflare-radar-ddos-leaked-credentials-bots/,"Extending Cloudflare Radar’s security insights with new DDoS, leaked credentials, and bots datasets",
"In addition, the worldwide view also breaks outbot traffic share by AS, mirroring the treemap shown in the Year in Review. As we have notedpreviously, cloud platform providers account for a significant amount of bot traffic.",Denial of Service,Cloudflare Blog,https://blog.cloudflare.com/cloudflare-radar-ddos-leaked-credentials-bots/,"Extending Cloudflare Radar’s security insights with new DDoS, leaked credentials, and bots datasets",
